{
  "schemaVersion": 1,
  "sessionId": "study-a-replace-with-unique-session-id",
  "evidenceOrigin": "physical",
  "supervised": true,
  "deviceModel": "iPhone 15 Pro Max",
  "iosVersion": "REPLACE",
  "browserMode": "safari",
  "startedAt": "REPLACE_WITH_ISO_TIMESTAMP",
  "endedAt": "REPLACE_WITH_ISO_TIMESTAMP",
  "environment": "open-sky",
  "routeId": "REPLACE",
  "parentPolicySha256": "REPLACE_WITH_64_HEX",
  "candidatePolicySha256": "REPLACE_WITH_64_HEX",
  "candidatePolicy": {
    "schemaVersion": 1,
    "policyVersion": "navigation-v2-calibration-2",
    "status": "calibration-only",
    "routeCorridorEnterM": 30,
    "routeCorridorExitM": 55,
    "finalCorridorMaxDeviationM": 25,
    "forwardTargetLookaheadM": 25,
    "maxGuidanceAccuracyM": 35,
    "maxMeasuredHeadingAccuracyDeg": 25,
    "nearEnterM": 120,
    "nearExitM": 150,
    "arrivalEndpointM": 30,
    "maxArrivalAccuracyM": 25,
    "arrivalConsecutiveSamples": 4,
    "arrivalMinimumDwellMs": 12000,
    "arrivalSampleWindowMs": 20000,
    "locationMaxAgeMs": 10000,
    "headingMaxAgeMs": 10000,
    "routeRevalidateAfterMs": 300000,
    "routeAbsoluteMaxAgeMs": 1800000,
    "postVisibilityRequiresNewLocation": true,
    "postVisibilityRequiresNewHeading": true,
    "arrivedIsLatched": true
  },
  "candidateInEnvelope": true,
  "unsafeEvents": 0,
  "outcomes": {
    "falseArrivals": 0,
    "directionOutsideExit": 0,
    "staleBackgroundArrows": 0,
    "directBearingFallbacks": 0,
    "duplicateListeners": 0,
    "newP0P1Defects": 0,
    "missedArrivals": 0,
    "recoveries": 0,
    "missedArrivalsReviewed": true,
    "recoveriesReviewed": true
  },
  "traceSha256": "REPLACE_WITH_64_HEX",
  "traceStoredPrivately": true,
  "supervisor": "REPLACE",
  "supervisorAttestationSha256": "REPLACE_WITH_64_HEX",
  "supervisorKeyId": "REPLACE_WITH_APPROVED_KEY_ID",
  "supervisorSignatureBase64": "REPLACE_WITH_ED25519_SIGNATURE"
}
